username	password	amount to invest	client_id	client_secret	user_agent
MassiveBluejay	notibbot	100	PY9hkXRGPWLq5w	KP6naniwqYFajrl0Vf2VslYWESA	2oQj5UgR2A4ALPNbDw help me invest please
GoneWildOnYourMom	notibbot	100	4j6V9mM-dMZ3Mg	0m-D1BP09F2KXOBzxgPa6DHypWQ	BlUe Hat INvEsTInG WiLl reVOluTioNize the market tbh
MassiveBulgyWulgy	notibbot	100	lBfJtgChAxxc2Q	tG5MbN-FL_qqjXi0wwj7otTA6ZU	i'm bad at investing and I need help please
DoraTheComfyExplorer	notibbot	100	0yO9pPgVdxfMUQ	oDoqF-msTt-huEXxk60e39TdikY	dora does investing using the map for max profit
ConfidentSpecialist0	notibbot	100	fDrEruirM3L9pA	dLn37t4CiFL6lSb3VmSXvj9miEo	boost confidence while investing
